id,meaning_en,meaning_ja,word_class,english_word_id,parent_id
3432,"A person, typically one more remote than a grandparent, from whom one is descended.",通常は祖父母よりも1人離れており、その子孫である人。,noun,1426,NULL
3433,"A thing that is accepted as true or as certain to happen, without proof.",証明なしで、真実として、または確実に起こると認められるもの。,noun,1428,NULL
3434,The action of taking on power or responsibility.,権力または責任を引き受ける行為。,noun,1428,NULL
3435,The reception of the Virgin Mary bodily into heaven. This was formally declared a doctrine of the Roman Catholic Church in 1950.,聖母マリアの体の天国への受け入れ。これは、1950年にローマカトリック教会の教義が正式に宣言されました。,noun,1428,NULL
3436,Arrogance or presumption.,傲慢または推定。,noun,1428,NULL
3437,Relating to a population subgroup (within a larger or dominant national or cultural group) with a common national or cultural tradition.,共通の国家的または文化的伝統を持つ集団サブグループ（より大きなまたは支配的な国家的または文化的グループ内）に関連する。,adjective,1429,NULL
3438,A member of an ethnic minority.,少数民族のメンバー。,noun,1429,NULL
3439,Causing great surprise or wonder; astonishing.,驚いたり驚いたりする。驚くべき。,adjective,1430,NULL
3440,"A small piece of something removed in the course of chopping, cutting, or breaking a hard material such as wood or stone.",木や石などの硬い材料を切り刻んだり、切断したり、割ったりする過程で取り除かれる小さなもの。,noun,1431,NULL
3441,"A thin slice of food (typically potato) made crisp by being fried, baked, or dried and eaten as a snack.",揚げたり、焼いたり、乾燥させてスナックとして食べたりすることで、スライスした食品（通常はジャガイモ）がカリカリになります。,noun,1431,NULL
3442,A tiny wafer of semiconducting material used to make an integrated circuit; a microchip.,集積回路の作成に使用される半導体材料の小さなウェーハ。マイクロチップ。,noun,1431,NULL
3443,A counter used in certain gambling games to represent money.,特定のギャンブルゲームでお金を表すために使用されるカウンター。,noun,1431,NULL
3444,"(in soccer, golf, and other sports) a short lofted kick or shot.",（サッカー、ゴルフ、その他のスポーツ）の短いロフトのキックまたはショット。,noun,1431,NULL
3445,Unpleasantly rough or jarring to the senses.,不快に感覚が荒くなったり、不快になったりします。,adjective,1432,NULL
3446,Cruel or severe.,残酷または厳しい。,adjective,1432,NULL
3447,"Someone who competes against or fights another in a contest, game, or argument; a rival or adversary.",コンテスト、ゲーム、または議論で他の人と競争するか、または戦う人。ライバルまたは敵。,noun,1434,NULL
3448,Say something as a comment; mention.,コメントとして何か言ってください。言及。,verb,1435,NULL
3449,Regard with attention; notice.,注意してください。通知。,verb,1435,NULL
3450,A written or spoken comment.,書面または口頭でのコメント。,noun,1435,NULL
3451,"Build or erect (something, typically a building, road, or machine)",構築または直立（何か、通常は建物、道路、または機械）,transitive verb,1436,NULL
3452,"An idea or theory containing various conceptual elements, typically one considered to be subjective and not based on empirical evidence.",さまざまな概念的要素を含むアイデアまたは理論。通常は主観的であり、経験的証拠に基づくものではないと見なされているもの。,noun,1436,NULL
3453,"Extremely large or great, especially in scale or degree.",特に規模や程度が非常に大きいか大きい。,adjective,1437,NULL
3454,A device or substance that is used to join two things together so as to prevent them from coming apart or to prevent anything from passing between them.,2つのものを結合して、それらがバラバラになったり、それらの間を通過したりするのを防ぐために使用されるデバイスまたは物質。,noun,1438,NULL
3455,"A piece of wax, lead, or other material with an individual design stamped into it, attached to a document to show that it has come from the person who claims to have issued it.",ワックス、鉛、またはその他の素材に個別のデザインがスタンプされたもの。ドキュメントに添付され、発行者であると主張した人物からのものであることを示します。,noun,1438,NULL
3456,A thing regarded as a confirmation or guarantee of something.,何かの確認または保証と見なされるもの。,noun,1438,NULL
3457,The obligation on a priest not to divulge anything said during confession.,告白中に述べられたことを漏らさないようにする司祭の義務。,noun,1438,NULL
3458,Fasten or close securely.,しっかりと締めるか、閉じます。,transitive verb,1438,NULL
3459,Apply a nonporous coating to (a surface) to make it impervious.,（表面）に無孔コーティングを施して、不浸透性にします。,transitive verb,1438,NULL
3460,Fry (food) briefly in hot fat to prevent it from losing too much of its moisture during subsequent cooking.,その後の調理中に水分が過剰に失われるのを防ぐために、熱い脂肪で簡単に揚げます。,transitive verb,1438,NULL
3461,"Conclude, establish, or secure (something) definitively, excluding the possibility of reversal or loss.",逆転または損失の可能性を除外して、確定的に（何か）を確立、確立、または保護します。,transitive verb,1438,NULL
3462,Fix a piece of wax or lead stamped with a design to (a document) to authenticate it.,ワックスまたは鉛でデザインを刻印したものを（ドキュメント）に固定して、認証します。,transitive verb,1438,NULL
3463,"A fish-eating aquatic mammal with a streamlined body and feet developed as flippers, that returns to land to breed or rest.",流線型の体と足を備えた魚を食べる水生哺乳動物。足ひれとして発達し、陸地に戻って繁殖または休息します。,noun,1438,NULL
3464,Causing death.,死を引き起こす。,adjective,1439,NULL
3465,A thing that is composed of two or more separate elements; a mixture.,2つ以上の個別の要素で構成されるもの。混合物。,noun,1441,NULL
3466,Made up or consisting of two or more existing parts or elements.,2つ以上の既存の部品または要素で構成されているか、それらで構成される。,adjective,1441,NULL
3467,Make up (a composite whole); constitute.,構成（複合全体）;構成します。,transitive verb,1441,NULL
3468,Make (something bad) worse; intensify the negative aspects of.,（何か悪いことを）悪化させる;の否定的な側面を強化します。,transitive verb,1441,NULL
3469,Forbear from prosecuting (a felony) in exchange for money or other consideration.,金銭その他の対価と引き換えに起訴（重罪）することを禁ずる。,transitive verb,1441,NULL
3470,"An open area enclosed by a fence, for example around a factory or large house or within a prison.",工場や大きな家の周り、または刑務所内など、フェンスで囲まれたオープンエリア。,noun,1441,NULL
3471,"Violent, uncontrollable anger.",暴力的でコントロールできない怒り。,noun,1442,NULL
3472,Feel or express violent uncontrollable anger.,暴力的な抑えきれない怒りを感じたり表現したりする。,intransitive verb,1442,NULL
3473,An unfavorable circumstance or condition that reduces the chances of success or effectiveness.,成功または効果の可能性を低下させる好ましくない状況または条件。,noun,1443,NULL
3474,Place in an unfavorable position in relation to someone or something else.,誰かまたは何か他のものに関して好ましくない位置に置く。,transitive verb,1443,NULL
3475,"A private teacher, typically one who teaches a single student or a very small group.",個人教師、通常は1人の生徒または非常に小さなグループを教える教師。,noun,1444,NULL
3476,Act as a tutor to (a single student or a very small group),（一人の学生または非常に小さなグループ）の家庭教師として行動する,transitive verb,1444,NULL
3477,"Alter or move (something) slightly in order to achieve the desired fit, appearance, or result.",目的のフィット感、外観、または結果を実現するために、少し変更（または何か）します。,verb,1445,NULL
3478,Assess (loss or damages) when settling an insurance claim.,保険金請求を決済するときに評価（損失または損害）。,verb,1445,NULL
3479,"The flat cutting edge of a knife, saw, or other tool or weapon.",ナイフ、のこぎり、その他の道具や武器の平らな刃先。,noun,1446,NULL
3480,According to the facts or exact meaning of something; strictly.,何かの事実または正確な意味によると、厳密に。,adverb,1447,NULL
3481,With reference to the technique displayed.,表示されたテクニックを参考に。,adverb,1447,NULL
3482,Involving or regarding the technology available.,利用可能な技術を含むか、それに関して。,adverb,1447,NULL
3483,Enlist (someone) in the armed forces.,（誰か）軍に参加してください。,transitive verb,1448,NULL
3484,A person newly enlisted in the armed forces and not yet fully trained.,新たに軍隊に入隊し、まだ完全に訓練されていない人。,noun,1448,NULL
3485,"Relating to, measuring, or measured by the quantity of something rather than its quality.",品質ではなく、何かの量に関連する、測定する、または測定される。,adjective,1449,NULL
3486,Discover the exact place or position of.,の正確な場所や位置を発見してください。,transitive verb,1450,NULL
3487,Resulting from or showing sincere and intense conviction.,誠実で強烈な信念から生じる、または示す。,adjective,1451,NULL
3488,A thing intended or regarded as a sign or promise of what is to come.,来るべきもののしるしまたは約束として意図または見なされるもの。,noun,1451,NULL
3489,The process or a period of changing from one state or condition to another.,ある状態または状態から別の状態または状態に変化するプロセスまたは期間。,noun,1452,NULL
3490,Undergo or cause to undergo a process or period of transition.,移行のプロセスまたは期間を経るか、または引き起こす。,verb,1452,NULL
3491,Force (something unwelcome or unfamiliar) to be accepted or put in place.,（歓迎されない、またはなじみのないものを）受け入れるか、または配置することを強制します。,verb,1453,NULL
3492,Take advantage of someone by demanding their attention or commitment.,彼らの注意やコミットメントを要求することによって誰かを利用します。,verb,1453,NULL
3493,Arrange (pages of type) so that they will be in the correct order after printing and folding.,（タイプのページ）を印刷して折りたたんだ後に正しい順序になるように配置します。,verb,1453,NULL
3494,One of a set of toothed wheels that work together to alter the relation between the speed of a driving mechanism (such as the engine of a vehicle or the crank of a bicycle) and the speed of the driven parts (the wheels),駆動機構（車両のエンジンや自転車のクランクなど）の速度と被駆動部品（車輪）の速度の関係を変更するために連動する歯車のセットの1つ,noun,1454,NULL
3495,Equipment that is used for a particular purpose.,特定の目的に使用される機器。,noun,1454,NULL
3496,Design or adjust the gears in a machine to give a specified speed or power output.,機械のギアを設計または調整して、指定された速度または出力を与えます。,transitive verb,1454,NULL
3497,Having great influence on someone or something.,誰かや何かに大きな影響を与えている。,adjective,1455,NULL
3498,An influential person.,影響力のある人。,noun,1455,NULL
3499,The action of traveling in or through an unfamiliar area in order to learn about it.,よく知らない地域を旅行する、または知らない場所を旅行すること。,noun,1456,NULL
3500,A place giving temporary protection from bad weather or danger.,悪天候や危険から一時的に保護する場所。,noun,1457,NULL
3501,"Protect or shield from something harmful, especially bad weather.",有害なもの、特に悪天候から保護またはシールドしてください。,transitive verb,1457,NULL
3502,A mark or a series of signs or objects left behind by the passage of someone or something.,誰かまたは何かの通過によって残されたマークまたは一連の標識またはオブジェクト。,noun,1458,NULL
3503,A long thin part or line stretching behind or hanging down from something.,後ろに伸びている、または何かから垂れ下がっている細長い部品または線。,noun,1458,NULL
3504,A beaten path through rough country such as a forest or moor.,森や湿原などの荒れた国を通る人道。,noun,1458,NULL
3505,"The rear end of a gun carriage, resting or sliding on the ground when the gun is unlimbered.",ガンキャリッジが後端にあり、ガンが吊り下げられていないときに地面で静止またはスライドします。,noun,1458,NULL
3506,Draw or be drawn along the ground or other surface behind someone or something.,誰かまたは何かの背後にある地面またはその他の表面に沿って描画または描画されます。,verb,1458,NULL
3507,Walk or move slowly or wearily.,ゆっくりと歩くか、疲れている。,verb,1458,NULL
3508,"Follow (a person or animal), typically by using marks, signs, or scent left behind.",（人または動物）を追跡します。通常は、マーク、標識、または残された香りを使用します。,verb,1458,NULL
3509,Be losing to an opponent in a game or contest.,ゲームやコンテストで相手に負けている。,verb,1458,NULL
3510,"Advertise (something, especially a film or program) in advance by broadcasting extracts or details.",抜粋や詳細を放送して、事前に宣伝します（何か、特に映画や番組）。,verb,1458,NULL
3511,Apply (slip) through a nozzle or spout to decorate ceramic ware.,陶器を装飾するために、ノズルまたは注ぎ口から適用（スリップ）します。,verb,1458,NULL
3512,Causing or feeling slight pain or physical discomfort.,軽い痛みや不快感を引き起こしたり感じたりします。,adjective,1459,NULL
3513,"Examine (something) methodically and in detail, typically in order to explain and interpret it.",（何か）を体系的かつ詳細に調べます。通常、それを説明して解釈します。,verb,1460,NULL
3514,Psychoanalyse (someone).,精神分析（誰か）。,verb,1460,NULL
3515,"Causing discomfort, unhappiness, or revulsion; disagreeable.",不快感、不幸、不快感を引き起こす;嫌い。,adjective,1461,NULL
3516,(of a person) sitting or standing with the back straight.,（人の）背中をまっすぐにして座ったり立ったり。,adjective,1462,NULL
3517,(of a person or their behavior) strictly honorable or honest.,（人または彼らの行動の）厳格に敬意を表するか正直である。,adjective,1462,NULL
3518,In or into a vertical position.,垂直位置または垂直位置。,adverb,1462,NULL
3519,"A post or rod fixed vertically, especially as a structural support.",特に構造サポートとして、垂直に固定された支柱またはロッド。,noun,1462,NULL
3520,An upright piano.,アップライトピアノ。,noun,1462,NULL
3521,"Give or grant someone (power, status, or recognition)",誰かに与えるか付与する（権限、ステータス、または認識）,verb,1463,NULL
3522,(of a concept or fact) be harmonious or consistent with.,（概念または事実の）調和している、または一貫している。,verb,1463,NULL
3523,An official agreement or treaty.,公式の合意または条約。,noun,1463,NULL
3524,A piece of evidence or information used in the detection of a crime or solving of a mystery.,犯罪の検出または謎の解決に使用される証拠または情報の一部。,noun,1464,NULL
3525,A verbal formula giving an indication as to what is to be inserted in a particular space in a crossword or other puzzle.,クロスワードやその他のパズルの特定のスペースに何を挿入するかを示す言葉の公式。,noun,1464,NULL
3526,"A cloud of tiny water droplets suspended in the atmosphere at or near the earth's surface limiting visibility, but to a lesser extent than fog; strictly, with visibility remaining above 1.5 miles (1 km)",地表またはその近くの大気中に浮遊している小さな水滴の雲が、視程を制限しているが、霧よりは少ない程度。厳密に、視界は1.5マイル（1 km）以上のまま,noun,1465,NULL
3527,Cover or become covered with mist.,ミストで覆うか、覆われます。,verb,1465,NULL
3528,Take part or intervene in an activity without invitation or necessity.,招待や必要なしに活動に参加したり介入したりする。,intransitive verb,1466,NULL
3529,Prevent (a process or activity) from continuing or being carried out properly.,（プロセスまたはアクティビティ）が継続したり、適切に実行されたりしないようにします。,intransitive verb,1466,NULL
3530,"Handle or adjust (something) without permission, especially so as to cause damage.",特に損傷を引き起こすように、許可なく（何か）を処理または調整します。,intransitive verb,1466,NULL
3531,(of light or other electromagnetic waveforms) mutually act upon each other and produce interference.,（光または他の電磁波形の）相互に作用し、干渉を生成します。,intransitive verb,1466,NULL
3532,(of a horse) knock one foot against the fetlock of another leg.,（馬の）別の足のフェットロックに対して片足をノックします。,intransitive verb,1466,NULL
3533,Look keenly or with difficulty at someone or something.,熱心に、または誰かまたは何かを困難に見てください。,verb,1467,NULL
3534,"A member of the nobility in Britain or Ireland, comprising the ranks of duke, marquess, earl, viscount, and baron.",英国またはアイルランドの貴族のメンバーで、公爵、侯爵、伯爵、子爵、男爵の階級で構成されています。,noun,1467,NULL
3535,"A person of the same age, status, or ability as another specified person.",別の指定された人と同じ年齢、地位、または能力の人。,noun,1467,NULL
3536,Make or become equal with or of the same rank.,同じランクのまたはと同じになる。,verb,1467,NULL
3537,"A small piece or amount of something, especially one that is left over after the greater part has been used.",小さな部分または何か、特に大部分が使用された後に残ったもの。,noun,1468,NULL
3538,Discarded metal for reprocessing.,再処理のために廃棄された金属。,noun,1468,NULL
3539,Publicly display (a work of art or item of interest) in an art gallery or museum or at a trade fair.,アートギャラリーや美術館、または見本市で（芸術作品または興味のあるアイテム）を公に展示します。,transitive verb,1469,NULL
3540,Manifest or deliberately display (a quality or a type of behavior),マニフェストまたは意図的な表示（品質または動作の種類）,transitive verb,1469,NULL
3541,An object or collection of objects on public display in an art gallery or museum or at a trade fair.,アートギャラリーや美術館、見本市などで公開されているオブジェクトまたはオブジェクトのコレクション。,noun,1469,NULL
3542,The stage of human social and cultural development and organization that is considered most advanced.,人間の社会的および文化的発展の段階と、最も進んでいると考えられている組織。,noun,1471,NULL
3543,"Make or become weaker in power, resolve, or physical strength.",力、決意、または体力を弱める。,verb,1472,NULL
3544,A particular part or feature of something.,何かの特定の部分または機能。,noun,1473,NULL
3545,The positioning of a building or thing in a specified direction.,指定された方向の建物または物の配置。,noun,1473,NULL
3546,A grammatical category or form that expresses the way in which time is denoted by the verb.,時間を動詞で表す方法を表す文法上のカテゴリまたはフォーム。,noun,1473,NULL
3547,(of a planet) form an aspect with (another celestial body),（惑星の）（別の天体）とアスペクトを形成する,transitive verb,1473,NULL
3548,Relating to or characterized by competition.,競争に関連する、または競争によって特徴付けられる。,adjective,1474,NULL
3549,As good as or better than others of a comparable nature.,同等の性質を持つ他のものと同等かそれ以上。,adjective,1474,NULL
3550,"An important assignment carried out for political, religious, or commercial purposes, typically involving travel.",政治的、宗教的、または商業的な目的で行われる重要な任務で、通常は旅行が含まれます。,noun,1475,NULL
3551,"The vocation or calling of a religious organization, especially a Christian one, to go out into the world and spread its faith.",宗教団体、特にキリスト教団体が世界に出てその信仰を広めることの召命または呼びかけ。,noun,1475,NULL
3552,"A strongly felt aim, ambition, or calling.",強く感じた目的、野心、または召し。,noun,1475,NULL
3553,As a result.,結果として。,adverb,1476,NULL
3554,A greater liking for one alternative over another or others.,ある選択肢を他の選択肢よりも好む。,noun,1477,NULL
3555,"A prior right or precedence, especially in connection with the payment of debts.",特に債務の支払いに関連する、事前の権利または優先権。,noun,1477,NULL
3556,"Impressively beautiful, elaborate, or extravagant; striking.",印象的に美しく、精巧で、贅沢なもの。印象的。,adjective,1478,NULL
3557,Very good; excellent.,とても良い;優秀な。,adjective,1478,NULL
3558,Behavior showing high moral standards.,高い道徳基準を示す行動。,noun,1479,NULL
3559,(in traditional Christian angelology) the seventh highest order of the ninefold celestial hierarchy.,（伝統的なキリスト教の天使学では）九重の天体階層の7番目に高い次数。,noun,1479,NULL
3560,"A red-brown metal, the chemical element of atomic number 29.",赤褐色の金属、原子番号29の化学元素。,noun,1480,NULL
3561,"A copper coin, especially a penny.",銅貨、特にペニー。,noun,1480,NULL
3562,A reddish-brown color like that of copper.,銅のような赤褐色。,noun,1480,NULL
3563,A small butterfly of North America and Eurasia. The upper surface of its wings is typically bright reddish-orange or purple.,北米とユーラシアの小さな蝶。翼の上面は通常、明るい赤みがかったオレンジ色または紫色です。,noun,1480,NULL
3564,Cover or coat (something) with copper.,銅で（何かを）カバーまたはコーティングします。,transitive verb,1480,NULL
3565,A police officer.,警察官。,noun,1480,NULL
3566,"Relating to, denoting, or preserving the character of an early stage in the evolutionary or historical development of something.",何かの進化または歴史的発展の初期段階の特徴に関連する、それを示す、または維持すること。,adjective,1481,NULL
3567,"Having a quality or style that offers an extremely basic level of comfort, convenience, or efficiency.",非常に基本的なレベルの快適さ、便利さ、または効率を提供する品質またはスタイルを持っている。,adjective,1481,NULL
3568,Not developed or derived from anything else.,他から開発または派生されたものではありません。,adjective,1481,NULL
3569,(of a part or structure) in the first or early stage of formation or growth; rudimentary.,（部品または構造の）形成または成長の最初または初期の段階;初歩的な。,adjective,1481,NULL
3570,"A person belonging to a preliterate, nonindustrial society.",文盲、非産業社会に属している人。,noun,1481,NULL
3571,A pre-Renaissance painter.,ルネサンス以前の画家。,noun,1481,NULL
3572,"A word, base, or root from which another is historically derived.",他の人が歴史的に派生した単語、ベース、またはルート。,noun,1481,NULL
3573,Become or make larger or more extensive.,大きくなるか、より広範囲になるようにします。,verb,1482,NULL
3574,Having or showing a strong desire and determination to succeed.,成功したいという強い願望と決意を持っている、または示している。,adjective,1484,NULL
3575,A state or situation in which something needed cannot be obtained in sufficient amounts.,必要なものが十分な量で入手できない状態または状況。,noun,1485,NULL
