id,meaning_en,meaning_ja,word_class,english_word_id,parent_id
5251,"A flat buoyant structure of timber or other materials fastened together, used as a boat or floating platform.",ボートまたはフローティングプラットフォームとして使用される、木材またはその他の材料を互いに固定した平らな浮力構造。,noun,2351,NULL
5252,Travel on or as if on a raft.,いかだに乗っているかのように旅行します。,verb,2351,NULL
5253,Bring or fasten together (a number of boats or other objects) side by side.,（多数のボートまたはその他のオブジェクト）を横に並べるか、一緒に固定します。,verb,2351,NULL
5254,A large amount of something.,大量のもの。,noun,2351,NULL
5255,Free from disturbance; calm.,妨害がない;落ち着いて。,adjective,2352,NULL
5256,"A distinguishing quality or characteristic, typically one belonging to a person.",特徴的な品質または特性。通常は、人に属します。,noun,2353,NULL
5257,Distribute or provide (a service or information) to a number of people.,（サービスまたは情報）を多数の人々に配布または提供します。,verb,2354,NULL
5258,Manage without or get rid of.,なしで管理するか、取り除く。,verb,2354,NULL
5259,A hope or ambition of achieving something.,何かを達成することへの希望または野心。,noun,2355,NULL
5260,The action or process of drawing breath.,息を引く行動またはプロセス。,noun,2355,NULL
5261,The action of pronouncing a sound with an exhalation of breath.,息を吐きながら音を発音する行為。,noun,2355,NULL
5262,A feature that renders something less acceptable; a disadvantage or problem.,受け入れ難いものをレンダリングする機能。欠点または問題。,noun,2356,NULL
5263,An amount of excise or import duty remitted on imported goods that the importer re-exports rather than sells domestically.,輸入者が国内で販売するのではなく、再輸出する輸入品に課税される物品税または輸入税。,noun,2356,NULL
5264,(of an object or course of action) not adapted for use or action; not sensible or realistic.,（オブジェクトまたは一連のアクションの）使用またはアクションに適合していない;賢明または現実的ではありません。,adjective,2357,NULL
5265,Impossible to do; impracticable.,実行できません。実行不可能。,adjective,2357,NULL
5266,"The traditional beliefs, customs, and stories of a community, passed through the generations by word of mouth.",コミュニティの伝統的な信仰、習慣、物語は口コミで世代を超えて受け継がれました。,noun,2358,NULL
5267,Including or containing people from many different countries.,多くの異なる国の人々を含む、または含む。,adjective,2359,NULL
5268,(of a plant or animal) found all over the world.,（植物または動物の）世界中で見つかりました。,adjective,2359,NULL
5269,A cosmopolitan person.,コスモポリタンな人。,noun,2359,NULL
5270,A plant or animal found all over the world.,世界中で見つかる植物や動物。,noun,2359,NULL
5271,"A cocktail typically made with vodka, Cointreau, cranberry juice, and lime juice.",通常、ウォッカ、コアントロー、クランベリージュース、ライムジュースで作られたカクテル。,noun,2359,NULL
5272,"A person who organizes and operates a business or businesses, taking on greater than normal financial risks in order to do so.",1つまたは複数のビジネスを組織して運営し、そのために通常よりも大きな財務リスクを負う人。,noun,2360,NULL
5273,Prevent (someone) from giving full attention to something.,（誰か）が何かに完全に注意を向けないようにします。,transitive verb,2361,NULL
5274,"An enclosed structure in which material can be heated to very high temperatures, e.g. for smelting metals.",材料を非常に高温に加熱できる密閉構造。金属の製錬用。,noun,2362,NULL
5275,Having or showing impressive beauty or dignity.,印象的な美しさや尊厳を持っている、または示している。,adjective,2363,NULL
5276,"(of a medical practitioner) advise and authorize the use of (a medicine or treatment) for someone, especially in writing.",（医師の）特に書面で誰かのために（薬または治療）の使用を助言および許可します。,transitive verb,2364,NULL
5277,Pull or twist out of shape.,引っ張ったり、ねじったりして形を整えます。,transitive verb,2365,NULL
5278,Give a misleading or false account or impression of.,誤解を招く、または虚偽の説明または印象を与える。,transitive verb,2365,NULL
5279,"Change the form of (an electrical signal or sound wave) during transmission, amplification, or other processing.",伝送、増幅、またはその他の処理中に（電気信号または音波）の形式を変更します。,transitive verb,2365,NULL
5280,A means of securing the necessities of life.,生活必需品を確保する手段。,noun,2366,NULL
5281,Exist in large numbers or amounts.,大量または大量に存在する。,intransitive verb,2367,NULL
5282,A savagely violent person or animal.,凶暴に暴力を振るう人または動物。,noun,2368,NULL
5283,An animal as opposed to a human being.,人間ではなく動物。,noun,2368,NULL
5284,Characterized by an absence of reasoning or intelligence.,推論や知性の欠如が特徴です。,adjective,2368,NULL
5285,Deny the truth of (a statement) by asserting the opposite.,反対を主張することにより、（声明）の真実を否定します。,transitive verb,2369,NULL
5286,A companion who shares one's activities or is a fellow member of an organization.,自分の活動を共有したり、組織の仲間のメンバーである仲間。,noun,2371,NULL
5287,"Drive or force (a liquid, especially a drug or vaccine) into a person or animal's body with a syringe or similar device.",注射器または同様のデバイスを使用して、人または動物の体内に（液体、特に薬物またはワクチン）を押し込むか押し込みます。,transitive verb,2372,NULL
5288,"Introduce (something) into a passage, cavity, or solid material under pressure.",圧力下で通路、空洞、または固体材料に（何か）を導入します。,transitive verb,2372,NULL
5289,"Introduce (a new or different element) into something, especially as a boost or interruption.",特に新しい要素または異なる要素を何かに導入します。特に、ブーストまたは中断として。,transitive verb,2372,NULL
5290,Place (a spacecraft or other object) into an orbit or trajectory.,（宇宙船または他のオブジェクト）を軌道または軌道に配置します。,transitive verb,2372,NULL
5291,Give a brief statement of the main points of (something),（何か）の主なポイントについて簡単に説明する,transitive verb,2373,NULL
5292,Having or showing initiative and resourcefulness.,イニシアチブと機知を持っている、または示すこと。,adjective,2374,NULL
5293,(of a place) deserted of people and in a state of bleak and dismal emptiness.,（場所の）人びとを捨て、暗く悲惨な空の状態に。,adjective,2375,NULL
5294,Make (a place) bleakly and depressingly empty or bare.,（場所）を弱く、憂鬱に空または裸にします。,transitive verb,2375,NULL
5295,A woody plant which is smaller than a tree and has several main stems arising at or near the ground.,木よりも小さく、地面またはその近くにいくつかの主要な茎が生じる木本。,noun,2376,NULL
5296,"A drink made of sweetened fruit juice and liquor, typically rum or brandy.",甘くされたフルーツジュースと酒、通常ラム酒またはブランデーで作られた飲み物。,noun,2376,NULL
5297,A slightly acid cordial made from fruit juice and water.,フルーツジュースと水から作られたわずかに酸性のコーディアル。,noun,2376,NULL
5298,"Cut (something) with a violent sweeping movement, typically using a knife or sword.",通常はナイフや刀を使って、激しい動きで（何かを）切ります。,transitive verb,2377,NULL
5299,"A cut made with a wide, sweeping stroke.",幅広の抜本的なストロークで作られたカット。,noun,2377,NULL
5300,"An oblique stroke (/) in print or writing, used between alternatives (e.g. and/or), in fractions (e.g. 3/4), in ratios (e.g. miles/day), or between separate elements of a text.",印刷または書き込みでの斜線（/）、代替（例：および/または）、分数（例：3/4）、比率（例：マイル/日）、またはテキストの個別の要素間。,noun,2377,NULL
5301,Debris resulting from the felling or destruction of trees.,木の伐採または破壊から生じる残骸。,noun,2377,NULL
5302,Used to link alternatives or words describing or denoting a dual (or multiple) function or nature.,デュアル（または複数の）機能または性質を説明または示す代替または単語をリンクするために使用されます。,conjunction,2377,NULL
5303,"A tract of swampy ground, especially in a coastal region.",特に沿岸地域での湿地帯。,noun,2377,NULL
5304,"A family of young animals, especially of a bird, produced at one hatching or birth.",若い動物の家族、特に鳥の孵化または出産時に生まれた家族。,noun,2378,NULL
5305,Think deeply about something that makes one unhappy.,人を不幸にする何かについて深く考えます。,verb,2378,NULL
5306,(of a bird) sit on (eggs) to hatch them.,（鳥の）それらを孵化させるために（卵）の上に座る。,verb,2378,NULL
5307,(of an animal) kept to be used for breeding.,（動物の）繁殖に使用するために保管されています。,adjective,2378,NULL
5308,"Of, determined by, or resembling the moon.",月の決定、または月に似ています。,adjective,2379,NULL
5309,Make or become less; diminish.,作るか少なくなる;減少します。,verb,2380,NULL
5310,Stay in a place longer than necessary because of a reluctance to leave.,立ち去りたくないので、必要以上に長い場所にいる。,intransitive verb,2381,NULL
5311,Get rid of (someone or something) as no longer useful or desirable.,（誰かまたは何か）を、もはや役に立たなくなった、または望ましくないものとして取り除きます。,transitive verb,2382,NULL
5312,A person or thing rejected as no longer useful or desirable.,役立たずまたは望まれないものとして拒否された人または物。,noun,2382,NULL
5313,"The angular distance of a place north or south of the earth's equator, or of a celestial object north or south of the celestial equator, usually expressed in degrees and minutes.",地球の赤道の北または南の場所、または天の赤道の北または南の天体の角距離。通常は度と分で表されます。,noun,2383,NULL
5314,Scope for freedom of action or thought.,行動または思考の自由の範囲。,noun,2383,NULL
5315,Goods to be bought and sold.,売買される商品。,noun,2384,NULL
5316,"Promote the sale of (goods), especially by their presentation in retail outlets.",（商品）の販売を、特に小売店での宣伝によって促進します。,transitive verb,2384,NULL
5317,The subjection of someone or something to contemptuous and dismissive language or behavior.,誰かまたは何かが軽蔑的で非難的な言葉や行動に付されること。,noun,2385,NULL
5318,Subject (someone or something) to contemptuous and dismissive language or behavior.,軽蔑的で非難的な言葉や行動の対象（誰かまたは何か）。,transitive verb,2385,NULL
5319,A mentally ill person (not in technical use).,精神障害者（技術的使用ではない）。,noun,2387,NULL
5320,Mentally ill (not in technical use),精神病（技術的使用ではない）,adjective,2387,NULL
5321,"Produce (something, especially a list, report, or book) by assembling information collected from other sources.",他のソースから収集した情報を集めて、何か（特にリスト、レポート、または本）を作成します。,transitive verb,2388,NULL
5322,(of a computer) convert (a program) into a machine-code or lower-level form in which the program can be executed.,（コンピュータの）プログラムを実行できるマシンコードまたは下位レベルの形式に（プログラムを）変換します。,transitive verb,2388,NULL
5323,Opposed to; against.,とは対照的に;に対して。,preposition,2389,NULL
5324,Opposed.,反対。,adjective,2389,NULL
5325,The feeling that someone or something is unworthy of one's consideration or respect; contempt.,誰かまたは何かが自分の配慮や尊敬に値しないという気持ち;軽蔑。,noun,2390,NULL
5326,Consider to be unworthy of one's consideration.,自分の配慮に値しないと考えてください。,transitive verb,2390,NULL
5327,Travel across or through.,横断または通過します。,transitive verb,2391,NULL
5328,Move (something) back and forth or sideways.,（何か）を前後または横に移動します。,transitive verb,2391,NULL
5329,Deny (an allegation) in pleading.,訴えを否定（申し立て）。,transitive verb,2391,NULL
5330,An act of traversing something.,何かを横断する行為。,noun,2391,NULL
5331,A part of a structure that extends or is fixed across something.,何かにまたがって拡張または固定されている構造の一部。,noun,2391,NULL
5332,A mechanism enabling a large gun to be turned to face a different direction.,大きな銃を別の方向に向けることができるメカニズム。,noun,2391,NULL
5333,"A single line of survey, usually plotted from compass bearings and chained or paced distances between angular points.",通常、コンパスの方位と、角度ポイント間の連鎖距離またはペーシング距離からプロットされた単一の測量線。,noun,2391,NULL
5334,A pair of right-angled bends incorporated in a trench to avoid enfilading fire.,炎の侵入を避けるために、トレンチに組み込まれた1対の直角ベンド。,noun,2391,NULL
5335,(of a curtain rod) allowing the curtain to be opened and closed by sliding it along the rod.,（カーテンロッドの）カーテンをロッドに沿ってスライドさせることにより、カーテンを開閉することができます。,adjective,2391,NULL
5336,"A small wave or series of waves on the surface of water, especially as caused by an object dropping into it or a slight breeze.",水面に小さな波または一連の波が発生します。特に、オブジェクトが水面に落ちたり、微風が吹いたりすると発生します。,noun,2393,NULL
5337,A type of ice cream with wavy lines of colored flavored syrup running through it.,色付きのフレーバーシロップが波状に流れるアイスクリーム。,noun,2393,NULL
5338,(of water) form or flow with a series of small waves on the surface.,（水の）表面に一連の小さな波が形成または流れる。,intransitive verb,2393,NULL
5339,"A flat, typically rectangular frame with a hinged pin, used for joining the ends of a belt or strap.",ベルトまたはストラップの端を接合するために使用される、ヒンジ付きピンを備えた、通常は長方形の平らなフレーム。,noun,2394,NULL
5340,A cake made with fruit (typically blueberries) and having a streusel topping.,フルーツ（通常はブルーベリー）を使用し、シュトロイゼルをトッピングしたケーキ。,noun,2394,NULL
5341,Fasten or decorate with a buckle.,バックルで留めるか飾ります。,verb,2394,NULL
5342,Bend and give way under pressure or strain.,圧力またはひずみの下で曲がって道を譲ります。,verb,2394,NULL
5343,A slowly moving mass or river of ice formed by the accumulation and compaction of snow on mountains or near the poles.,山または極の近くの雪の蓄積と圧縮によって形成される、ゆっくりと移動する氷の塊または川。,noun,2395,NULL
5344,A beehive.,蜂の巣。,noun,2396,NULL
5345,A place in which people are busily occupied.,人が多忙な場所。,noun,2396,NULL
5346,Place (bees) in a hive.,ハイブにハチを置きます。,transitive verb,2396,NULL
5347,Move or cause to move in a circle around an axis or center.,軸または中心を中心に円を描くように移動または移動します。,verb,2397,NULL
5348,"Show or represent by a drawing, painting, or other art form.",ドローイング、ペインティング、またはその他のアート形式で表示または表現します。,transitive verb,2399,NULL
5349,Unable to read or write.,読み書きできません。,adjective,2400,NULL
5350,A person who is unable to read or write.,読み書きができない人。,noun,2400,NULL
5351,"(of ice, snow, or another frozen substance, such as food) become liquid or soft as a result of warming.",（氷、雪、または食品などの別の凍結物質）は、加温の結果として液体または柔らかくなります。,intransitive verb,2401,NULL
5352,A period of warmer weather that thaws ice and snow.,氷と雪が溶ける暖かい季節。,noun,2401,NULL
5353,Create again.,もう一度作成します。,transitive verb,2403,NULL
5354,Light up.,ライトアップ。,transitive verb,2404,NULL
5355,Help to clarify or explain.,明確化または説明するのに役立ちます。,transitive verb,2404,NULL
5356,"Decorate (a page or letter in a manuscript) by hand with gold, silver, or colored designs.",金、銀、または色付きのデザインで手で装飾（原稿のページまたは文字）します。,transitive verb,2404,NULL
5357,Come before (something) in time.,時間の前に（何か）来る。,transitive verb,2405,NULL
5358,"Dull, tedious, and repetitious; lacking in variety and interest.",退屈で退屈で繰り返しの多い。多様性と興味に欠けている。,adjective,2406,NULL
5359,Shut and open the eyes quickly.,目を閉じてすばやく開きます。,intransitive verb,2407,NULL
5360,(of a light or light source) shine intermittently or unsteadily.,（光源または光源の）断続的または不安定に輝きます。,intransitive verb,2407,NULL
5361,An act of shutting and opening the eyes quickly.,目をすばやく開閉する行為。,noun,2407,NULL
5362,A momentary gleam of light.,一瞬の光の輝き。,noun,2407,NULL
5363,Direct one's hopes or ambitions towards achieving something.,何かを達成することへの希望や野心を向ける。,intransitive verb,2408,NULL
5364,Rise high; tower.,高く上がる;タワー。,intransitive verb,2408,NULL
5365,Appoint (someone) to a specified position.,指定された位置に（誰か）を任命します。,transitive verb,2409,NULL
5366,Appointed to an office or position but not yet installed.,事務所または役職に任命されたが、まだ設置されていない。,adjective,2409,NULL
5367,"An imaginary line drawn around the earth equally distant from both poles, dividing the earth into northern and southern hemispheres and constituting the parallel of latitude 0°.",両極から等しく離れた地球の周りに描かれた想像上の線。地球を北半球と南半球に分割し、緯度0°の平行線を構成します。,noun,2412,NULL
5368,Fit to be eaten (often used to contrast with unpalatable or poisonous examples),食べるのに適しています（口当たりが悪いまたは有毒な例と対比するためによく使用されます）,adjective,2413,NULL
5369,Items of food.,食べ物のアイテム。,noun,2413,NULL
5370,Fond of games and amusement; lighthearted.,ゲームや娯楽が好きです。気軽。,adjective,2414,NULL
5371,Done at random or without careful judgment.,ランダムに、または慎重な判断なしに行われます。,adjective,2416,NULL
5372,"Make a continuous deep, resonant sound.",深みのある共鳴音を連続して鳴らします。,verb,2417,NULL
5373,Discover (an illicit activity or its perpetrator),発見する（違法行為またはその犯人）,verb,2417,NULL
5374,Take part in a street fight between gangs or large groups.,ギャングや大規模なグループ間のストリートファイトに参加してください。,verb,2417,NULL
5375,"A continuous deep, resonant sound like distant thunder.",遠くの雷のような連続した深みのある共鳴音。,noun,2417,NULL
5376,A street fight between gangs or large groups.,ギャングまたは大規模なグループ間のストリートファイト。,noun,2417,NULL
5377,Conducive to or suggestive of good health and physical well-being.,健康と肉体的幸福を助長または示唆します。,adjective,2418,NULL
5378,"An object surviving from an earlier time, especially one of historical or sentimental interest.",以前の時代から生き残ったオブジェクト、特に歴史的または感傷的な興味の1つ。,noun,2419,NULL
5379,A magazine or newspaper published at regular intervals.,定期的に発行される雑誌または新聞。,noun,2420,NULL
5380,Occurring or appearing at intervals; occasional.,間隔を置いて発生または出現する;時々。,adjective,2420,NULL
5381,A small stone made smooth and round by the action of water or sand.,小さな石が水や砂の作用で滑らかで丸くなります。,noun,2422,NULL
5382,(of an eyeglass lens) very thick and convex.,（眼鏡レンズの）非常に厚く、凸面。,adjective,2422,NULL
5383,Not pleasant or enjoyable.,楽しくも楽しくもありません。,adjective,2423,NULL
5384,Become actual fact; happen.,実際の事実になります。起こります。,intransitive verb,2425,NULL
5385,"(of a ghost, spirit, or similar entity) appear in bodily form.",（幽霊、霊、または類似の実体の）体の形で表示されます。,intransitive verb,2425,NULL
5386,Having straight parallel sides and a circular or oval cross-section; in the shape or form of a cylinder.,まっすぐな平行な側面と円形または楕円形の断面を持つ。円柱の形または形で。,adjective,2426,NULL
5387,(of two things) able to be interchanged.,（2つのものの）交換できます。,adjective,2427,NULL
5388,Able or fit to be sold or marketed.,販売または市場に出すことができる、または適合する。,adjective,2428,NULL
5389,Put (someone or something) at risk or in danger.,（誰かまたは何か）を危険または危険にさらす。,transitive verb,2429,NULL
5390,Make or become unlikely to give way or overturn.,道を譲ったり、転覆させたりする可能性はありません。,verb,2430,NULL
5391,"Take over the place, position, or role of (someone or something)",（誰かまたは何か）の場所、位置、または役割を引き継ぐ,transitive verb,2431,NULL
5392,Bring out of sleep; awaken.,眠りから覚める。目覚める。,transitive verb,2432,NULL
5393,Cause to feel angry or excited.,怒ったり、興奮したりします。,transitive verb,2432,NULL
5394,"Stir (a liquid, especially beer while brewing)",かき混ぜる（液体、特に醸造中のビール）,transitive verb,2432,NULL
5395,Haul (something) vigorously in the specified direction.,指定された方向に強く（何かを）運搬します。,transitive verb,2432,NULL
5396,Work extremely hard or incessantly.,非常に熱心にまたは絶え間なく働きます。,intransitive verb,2433,NULL
5397,Exhausting physical labor.,肉体労働を使い果たす。,noun,2433,NULL
5398,Characterized by idealism; unrealistically aiming for perfection.,理想主義が特徴;非現実的に完璧を目指しています。,adjective,2434,NULL
5399,"Showing a lack of worry or interest, especially when this is surprising or callous.",特にこれが意外または無神経である場合、心配や関心の欠如を示す。,adjective,2435,NULL
5400,Care for and encourage the growth or development of.,の成長または発展を気遣い、奨励する。,transitive verb,2436,NULL
5401,The process of caring for and encouraging the growth or development of someone or something.,誰かまたは何かの成長または発達を世話し、促進するプロセス。,noun,2436,NULL
5402,Fit panes of glass into (a window or doorframe or similar structure),窓ガラスまたは窓枠または類似の構造にガラス板をはめ込む,transitive verb,2437,NULL
5403,"Overlay or cover (food, fabric, etc.) with a smooth, shiny coating or finish.",滑らかで光沢のあるコーティングまたは仕上げのオーバーレイまたはカバー（食品、布地など）。,transitive verb,2437,NULL
5404,Lose brightness and animation.,明るさとアニメーションを失います。,transitive verb,2437,NULL
5405,A vitreous substance fused on to the surface of pottery to form an impervious decorative coating.,陶器の表面にガラス質の物質が融合し、不浸透性の装飾コーティングを形成します。,noun,2437,NULL
5406,"A liquid such as milk or beaten egg used to form a smooth, shiny coating on food.",食品に滑らかで光沢のあるコーティングを形成するために使用されるミルクや溶き卵などの液体。,noun,2437,NULL
5407,"A thin, glassy coating of ice on the ground or the surface of water.",地面または水面の氷の薄いガラス状のコーティング。,noun,2437,NULL
