id,meaning_en,meaning_ja,word_class,english_word_id,parent_id
1749,(of a record) enter the weekly music charts at a particular position.,（レコードの）特定の位置に毎週の音楽チャートを入力してください。,verb,652,NULL
1750,The state or condition of lacking strength.,力不足の状態または状態。,noun,653,NULL
1751,Very fine in texture or structure; of intricate workmanship or quality.,テクスチャまたは構造が非常に細かい。複雑な仕上がりや品質の。,adjective,654,NULL
1752,Easily broken or damaged; fragile.,破損または損傷しやすい。壊れやすい。,adjective,654,NULL
1753,Requiring sensitive or careful handling.,慎重な取り扱いが必要です。,adjective,654,NULL
1754,A delicate fabric or garment made of such fabric.,繊細な生地またはそのような生地で作られた衣服。,noun,654,NULL
1755,Employ (someone) for wages.,賃金には（誰か）を雇う。,transitive verb,655,NULL
1756,Obtain the temporary use of (something) for an agreed payment; rent.,合意された支払いのための（何か）の一時的な使用を取得します。家賃。,transitive verb,655,NULL
1757,The action of hiring someone or something.,誰かまたは何かを雇う行為。,noun,655,NULL
1758,A person who is hired; an employee.,雇われた人;従業員。,noun,655,NULL
1759,Make (something) on a large scale using machinery.,機械を使って（何かを）大規模に作ります。,transitive verb,656,NULL
1760,Invent or fabricate (evidence or a story),発明または製作（証拠またはストーリー）,transitive verb,656,NULL
1761,The making of articles on a large scale using machinery.,機械を使った大規模なモノづくり。,noun,656,NULL
1762,A very young child or baby.,非常に幼い子供または赤ちゃん。,noun,657,NULL
1763,Out from a starting point and forward or into view.,出発点から外に出て、前方または視野に入る。,adverb,658,NULL
1764,A river in central Scotland that rises on Ben Lomond and flows east into the North Sea.,スコットランド中心部のベンローモンドにそびえ、東に北海に注ぐ川。,proper noun,658,NULL
1765,Magnificent; very impressive.,壮大;非常に印象的。,adjective,659,NULL
1766,"Bring back (a previous right, practice, custom, or situation); reinstate.",元に戻す（以前の権利、慣習、習慣、または状況）;復活させる。,transitive verb,660,NULL
1767,Extremely interesting.,非常に興味深い。,adjective,661,NULL
1768,"A device or enclosure designed to catch and retain animals, typically by allowing entry but not exit or by catching hold of a part of the body.",動物を捕まえて保持するために設計されたデバイスまたはエンクロージャー。通常は、出入りは許可するが退出は許可しないか、身体の一部をつかむことによって行います。,noun,662,NULL
1769,A situation in which people lie in wait to make a surprise attack.,人々が奇襲を仕掛けるのを待っている状況。,noun,662,NULL
1770,A container or device used to collect a specified thing.,特定のものを収集するために使用されるコンテナまたはデバイス。,noun,662,NULL
1771,"A light, two-wheeled carriage pulled by a horse or pony.",馬やポニーが牽引する軽い二輪車。,noun,662,NULL
1772,A device for hurling an object such as a clay pigeon into the air to be shot at.,土鳩などの物体を空中に放り投げる装置。,noun,662,NULL
1773,A person's mouth (used in expressions to do with speaking),人の口（話すことを表現するために使用されます）,noun,662,NULL
1774,(among jazz musicians) drums or percussion instruments.,（ジャズミュージシャンの中で）ドラムまたは打楽器。,noun,662,NULL
1775,A type of hip-hop music typically characterized by a dark tone and rhythms involving low-pitched kick drums and a very fast hi-hat.,低音のキックドラムと非常に速いハイハットを含む暗い音色とリズムを特徴とするヒップホップ音楽の一種。,noun,662,NULL
1776,A place where drugs are sold.,薬が売られている場所。,noun,662,NULL
1777,An act of trapping the ball.,ボールを捕まえる行為。,noun,662,NULL
1778,"A vehicle specially equipped for taking sick or injured people to and from the hospital, especially in emergencies.",特に緊急時に、病人やけが人を病院に連れて行くために特別に装備された車両。,noun,663,NULL
1779,"A cultivated plant that is grown as food, especially a grain, fruit, or vegetable.",食用、特に穀物、果物、野菜として栽培される栽培植物。,noun,664,NULL
1780,A group or amount of related people or things appearing or occurring at one time.,一度に出現または発生する関連する人々または物のグループまたは量。,noun,664,NULL
1781,A hairstyle in which the hair is cut very short.,髪が非常に短くなる髪型。,noun,664,NULL
1782,A pouch in a bird's gullet where food is stored or prepared for digestion.,食物が保管されている、または消化のために準備されている鳥の食道内のポーチ。,noun,664,NULL
1783,The entire tanned hide of an animal.,動物の日焼けした皮全体。,noun,664,NULL
1784,"A violent and destructive shattering or blowing apart of something, as is caused by a bomb.",爆弾によって引き起こされる、暴力的で破壊的な何かが粉々に砕け散る。,noun,665,NULL
1785,A young sheep.,若い羊。,noun,666,NULL
1786,Notice or perceive (something) and register it as being significant.,（何か）に気づくか、または認識して、重要であると登録します。,transitive verb,667,NULL
1787,Make a remark.,発言してください。,transitive verb,667,NULL
1788,"Fulfill or comply with (a social, legal, ethical, or religious obligation)",（社会的、法的、倫理的、または宗教的義務を）履行または遵守する,transitive verb,667,NULL
1789,A piece of cloth or other material used to mend or strengthen a torn or weak point.,裂け目や弱点を修正または強化するために使用される布またはその他の材料。,noun,668,NULL
1790,A part of something marked out from the rest by a particular characteristic.,特定の特性によって残りの部分からマークされた何かの一部。,noun,668,NULL
1791,"A small piece of ground, especially one used for gardening.",小さな地面、特に園芸に使用される地面。,noun,668,NULL
1792,A period of time seen as a distinct unit with a characteristic quality.,特徴的な品質を備えた別個の単位と見なされる期間。,noun,668,NULL
1793,A temporary electrical or telephone connection.,一時的な電気または電話接続。,noun,668,NULL
1794,A small piece of code inserted into a program to improve its functioning or to correct an error.,プログラムに挿入された小さなコードで、プログラムの機能を改善したり、エラーを修正したりします。,noun,668,NULL
1795,Mend or strengthen (fabric or an item of clothing) by putting a piece of material over a hole or weak point in it.,穴や弱点に素材をかぶせることで（布地や衣類のアイテム）を修繕または強化します。,transitive verb,668,NULL
1796,"Treat someone's injuries or repair the damage to something, especially hastily.",特に急いで、誰かの怪我を治療したり、何かへの損傷を修復したりします。,transitive verb,668,NULL
1797,"Connect by a temporary electrical, radio, or telephonic connection.",一時的な電気、無線、または電話接続で接続します。,transitive verb,668,NULL
1798,"Correct, enhance, or modify (a routine or program) by inserting a patch.",パッチを挿入することにより、修正、強化、または変更（ルーチンまたはプログラム）を行います。,transitive verb,668,NULL
1799,"A flowering plant's unit of reproduction, capable of developing into another such plant.",別のそのような植物に成長することができる顕花植物の生殖の単位。,noun,669,NULL
1800,A man's semen.,男の精液。,noun,669,NULL
1801,Any of a number of stronger competitors in a sports tournament who have been assigned a specified position in an ordered list with the aim of ensuring that they do not play each other in the early rounds.,スポーツトーナメントで、序盤のラウンドでお互いにプレーしないようにするために、順序付けられたリストで特定の位置を割り当てられている多くの強力な選手。,noun,669,NULL
1802,A small crystal introduced into a liquid to act as a nucleus for crystallization.,液体に導入され、結晶化の核となる小さな結晶。,noun,669,NULL
1803,A small container for radioactive material placed in body tissue during radiotherapy.,放射線治療中に身体組織に配置される放射性物質の小さな容器。,noun,669,NULL
1804,Sow (land) with seeds.,種をまく（土地）。,verb,669,NULL
1805,(of a plant) produce or drop seeds.,（植物の）種子を生産または落とす。,verb,669,NULL
1806,Remove the seeds from (vegetables or fruit),（野菜または果物）から種子を取り除く,verb,669,NULL
1807,Give (a competitor) the status of seed in a tournament.,トーナメントでシードのステータスを（競合他社に）与える。,verb,669,NULL
1808,"The study of the physical features of the earth and its atmosphere, and of human activity as it affects and is affected by these, including the distribution of populations and resources, land use, and industries.",人口と資源の分布、土地利用、産業など、地球とその大気の物理的特徴、およびそれらが影響を受けて影響を受ける人間の活動の研究。,noun,670,NULL
1809,A state of confusion.,混乱の状態。,noun,671,NULL
1810,Disrupt the systematic functioning or neat arrangement of.,体系的な機能またはきちんとした配置を混乱させます。,transitive verb,671,NULL
1811,"Either of the two soft, protruding organs on the upper front of a woman's body that secrete milk after pregnancy.",妊娠後に乳汁を分泌する、女性の体の前面上部にある2つの柔らかく突出した器官のいずれか。,noun,672,NULL
1812,Face and move forward against or through (something),（何か）に直面する,transitive verb,672,NULL
1813,"Demand something forcefully, not accepting refusal.",拒絶を受け入れずに、力強く何かを要求する。,intransitive verb,673,NULL
1814,It is fortunate that.,それは幸運です。,adverb,674,NULL
1815,Causing or likely to cause horror; shocking.,恐怖を引き起こしたり、引き起こしたりする可能性が高い;ショッキング。,adjective,675,NULL
1816,An act of hitting or striking someone or something; a blow.,誰かまたは何かを打つまたは打つ行為。ブロー。,noun,677,NULL
1817,"A mark made by drawing a pen, pencil, or paintbrush in one direction across paper or canvas.",ペン、鉛筆、または絵筆を紙またはキャンバス上で一方向に描くことによって作成されたマーク。,noun,677,NULL
1818,An act of moving one's hand across a surface with gentle pressure.,穏やかな圧力で表面を横切って手を動かす行為。,noun,677,NULL
1819,"A movement, especially one of a series, in which something moves out of its position and back into it; a beat.",ムーブメント、特にシリーズの1つで、何かがその位置から出てそこに戻る動き。ビート。,noun,677,NULL
1820,"A sudden disabling attack or loss of consciousness caused by an interruption in the flow of blood to the brain, especially through thrombosis.",特に血栓症を介した脳への血流の中断によって引き起こされる突然の無力化攻撃または意識喪失。,noun,677,NULL
1821,"Move one's hand with gentle pressure over (a surface, especially hair, fur, or skin), typically repeatedly; caress.",通常は繰り返し、穏やかな圧力で表面（特に髪、毛皮、または皮膚）を動かします。愛撫。,transitive verb,677,NULL
1822,Act as the stroke of (a boat or crew),（ボートまたはクルー）のストロークとして機能する,transitive verb,677,NULL
1823,Hit or kick (a ball) smoothly and deliberately.,（ボールを）スムーズに、そして故意にヒットまたはキックします。,transitive verb,677,NULL
1824,"A tree that bears acorns as fruit, and typically has lobed deciduous leaves. Oaks are common in many north temperate forests and are an important source of hard and durable wood used chiefly in construction, furniture, and (formerly) shipbuilding.",ドングリを果実として育て、通常は落葉性の葉を葉につける木。オークは、多くの北温帯林で一般的であり、主に建設、家具、および（以前の）造船で使用される硬くて耐久性のある木材の重要な供給源です。,noun,678,NULL
1825,"A broad road in a town or city, typically having trees at regular intervals along its sides.",町または都市の広い道路で、通常はその側面に沿って一定の間隔で樹木があります。,noun,680,NULL
1826,A way of approaching a problem or making progress toward something.,問題に取り組み、何かに向かって前進する方法。,noun,680,NULL
1827,"Any of the world's main continuous expanses of land (Africa, Antarctica, Asia, Australia, Europe, North America, South America).",世界の主要な継続的な土地の広がり（アフリカ、南極大陸、アジア、オーストラリア、ヨーロッパ、北アメリカ、南アメリカ）。,noun,681,NULL
1828,Able to control movements of the bowels and bladder.,腸や膀胱の動きを制御できる。,adjective,681,NULL
1829,"Exercising self-restraint, especially sexually.",特に性的に自己拘束を行う。,adjective,681,NULL
1830,"A person, especially a police officer, whose occupation is to investigate and solve crimes.",犯罪の調査と解決を目的とする人物、特に警察官。,noun,682,NULL
1831,The action of stopping something from happening or arising.,何かの発生または発生を止める行為。,noun,683,NULL
1832,"A melody, especially one which characterizes a certain piece of music.",メロディー、特に特定の音楽を特徴付けるもの。,noun,684,NULL
1833,Adjust (a musical instrument) to the correct or uniform pitch.,（楽器）を正しいまたは均一なピッチに調整します。,transitive verb,684,NULL
1834,Adjust (a receiver circuit such as a radio or television) to the frequency of the required signal.,必要な信号の周波数に合わせて（ラジオやテレビなどの受信回路）を調整します。,transitive verb,684,NULL
1835,Adjust (an engine) or balance (mechanical parts) so that a vehicle runs smoothly and efficiently.,車両がスムーズかつ効率的に走行するように（エンジン）またはバランス（機械部品）を調整します。,transitive verb,684,NULL
1836,Adjust or adapt (something) to a particular purpose or situation.,特定の目的または状況に（何かを）調整または適応します。,transitive verb,684,NULL
1837,"Dismiss as inadequate, inappropriate, or not to one's taste.",不適切、不適切、または好みに応じて解雇する。,transitive verb,685,NULL
1838,A person or thing dismissed as failing to meet standards or satisfy tastes.,基準を満たしていない、または好みを満たしていないとして却下された人または物。,noun,685,NULL
1839,A person who operates equipment or a machine.,機器や機械を操作する人。,noun,686,NULL
1840,A person or company that engages in or runs a business or enterprise.,ビジネスまたは企業に従事または経営している人または会社。,noun,686,NULL
1841,"A person who acts in a specified, especially a manipulative, way.",特定の、特に操作的な方法で行動する人。,noun,686,NULL
1842,"A symbol or function denoting an operation (e.g. ×, +).",演算を表す記号または関数（例：×、+）。,noun,686,NULL
1843,Showing signs of future success.,将来の成功の兆しを見せています。,adjective,687,NULL
1844,Have as belonging to one; own.,一つに属するものとして持ってください。自分の。,transitive verb,688,NULL
1845,"(of a demon or spirit, especially an evil one) have complete power over (someone) and be manifested through their speech or actions.",（悪魔や霊、特に悪魔の）は（誰か）に対して完全な力を持ち、彼らのスピーチや行動を通して明らかにされます。,transitive verb,688,NULL
1846,Have sexual intercourse with (a woman),（女性）と性交する,transitive verb,688,NULL
1847,Maintain (oneself or one's mind or soul) in a state or condition of patience or quiet.,忍耐または静寂の状態または状態に（自分自身または自分の心または魂）を維持します。,transitive verb,688,NULL
1848,A person who gives advice in a particular field.,特定の分野でアドバイスをする人。,noun,689,NULL
1849,"Something, especially a structure, established to remind people of a person or event.",人やイベントを思い出させるために確立された何か、特に構造。,noun,690,NULL
1850,"A statement of facts, especially as the basis of a petition.",事実の陳述、特に請願の根拠として。,noun,690,NULL
1851,A cunning or skillful act or scheme intended to deceive or outwit someone.,誰かを欺く、または裏切ることを目的とした、狡猾で巧妙な行為またはスキーム。,noun,691,NULL
1852,A peculiar or characteristic habit or mannerism.,独特または特徴的な習慣またはマニエリスム。,noun,691,NULL
1853,"(in bridge, whist, and similar card games) a sequence of cards forming a single round of play. One card is laid down by each player, the highest card being the winner.",（ブリッジ、ホイスト、および類似のカードゲームで）1ラウンドのプレイを形成する一連のカード。各プレイヤーは1枚のカードを置き、最も高いカードが勝者になります。,noun,691,NULL
1854,A prostitute's client.,売春婦のクライアント。,noun,691,NULL
1855,"A sailor's turn at the helm, usually lasting for two or four hours.",船乗りが舵を取り、通常2〜4時間続く。,noun,691,NULL
1856,Deceive or outwit (someone) by being cunning or skillful.,狡猾または巧みなことによって、だれかを裏切る（誰か）。,transitive verb,691,NULL
1857,"Sketch (a coat of arms) in outline, with the colors indicated by letters or signs.",スケッチ（紋章）の輪郭を、色を文字または記号で示します。,transitive verb,691,NULL
1858,"Intended or used to deceive or mystify, or to create an illusion.",騙したり、謎を解いたり、幻想を作成したりするために使用されます。,adjective,691,NULL
1859,Liable to fail; defective.,失敗する可能性があります。不良品。,adjective,691,NULL
1860,"A steep rock face, especially at the edge of the sea.",特に海の端にある急な岩肌。,noun,692,NULL
1861,"The protruding part of the face below the mouth, formed by the apex of the lower jaw.",下顎の頂点によって形成される、口の下の顔の突出部分。,noun,693,NULL
1862,"Draw one's body up so as to bring one's chin level with or above (a horizontal bar) with one's feet off the ground, as an exercise.",エクササイズとして、足を地面から離して顎の高さ（水平バー）以上になるように身体を引き上げます。,transitive verb,693,NULL
1863,"An overflowing of a large amount of water beyond its normal confines, especially over what is normally dry land.",通常の範囲を超えて、特に通常は乾燥した土地で大量の水が溢れています。,noun,694,NULL
1864,An outpouring of tears or emotion.,涙や感情の溢れ。,noun,694,NULL
1865,Cover or submerge (a place or area) with water.,カバーまたは水（場所または領域）を水に浸します。,verb,694,NULL
1866,Arrive in overwhelming amounts or quantities.,圧倒的な量または量で到着します。,verb,694,NULL
1867,An entrance to a room or building through a door.,ドアから部屋または建物への入り口。,noun,695,NULL
1868,Relieve (a person or animal) of the symptoms of a disease or condition.,病気または状態の症状を（人または動物で）緩和する。,transitive verb,696,NULL
1869,"Preserve (meat, fish, tobacco, or an animal skin) by various methods such as salting, drying, or smoking.",塩漬け、乾燥、喫煙などのさまざまな方法で保存します（肉、魚、タバコ、または動物の皮膚）。,transitive verb,696,NULL
1870,A substance or treatment that cures a disease or condition.,疾患または状態を治す物質または治療。,noun,696,NULL
1871,"The process of curing rubber, plastic, or other material.",ゴム、プラスチック、その他の材料を硬化させるプロセス。,noun,696,NULL
1872,A Christian minister's pastoral charge or area of responsibility for spiritual ministry.,キリスト教の牧師の司牧的責任または精神的な奉仕に対する責任の領域。,noun,696,NULL
1873,A parish priest in a French-speaking country or region.,フランス語圏の国または地域の教区司祭。,noun,696,NULL
1874,Sadness or displeasure caused by the nonfulfillment of one's hopes or expectations.,希望や期待が満たされないことによって引き起こされる悲しみや不快感。,noun,697,NULL
1875,Not often; rarely.,しばしばあるわけではない;めったにない。,adverb,698,NULL
1876,Not common; infrequent.,一般的ではありません。まれ。,adjective,698,NULL
1877,Give (someone) facts or information; tell.,（誰かに）事実または情報を与える;言う。,verb,699,NULL
1878,Give an essential or formative principle or quality to.,本質的または形成的な原則または品質を与える。,verb,699,NULL
1879,"A strong, regular, repeated pattern of movement or sound.",強く、規則正しく繰り返される動きや音のパターン。,noun,701,NULL
1880,"Make (a hole) in something, especially with a revolving tool.",特に回転工具を使用して、何かに（穴をあける）。,verb,702,NULL
1881,Make one's way through (a crowd).,通り抜ける（群集）。,verb,702,NULL
1882,The hollow part inside a gun barrel or other tube.,銃身または他の管の内部の中空部分。,noun,702,NULL
1883,A person whose talk or behavior is dull and uninteresting.,会話や行動が鈍くて面白くない人。,noun,702,NULL
1884,Make (someone) feel weary and uninterested by tedious talk or dullness.,退屈な話や鈍いことで、（誰かが）疲れていて興味がないと感じさせる。,transitive verb,702,NULL
1885,A steep-fronted wave caused by the meeting of two tides or by the constriction of a tide rushing up a narrow estuary.,2つの潮の出会い、または狭い河口に押し寄せる潮の収縮によって引き起こされた急勾配の波。,noun,702,NULL
1886,"Of uncertain, indefinite, or unclear character or meaning.",不確実、不明確、または不明確な性質または意味の。,adjective,703,NULL
1887,The edge or border of something.,何かの縁または境界。,noun,704,NULL
1888,An amount by which a thing is won or falls short.,物が勝った、または足りない金額。,noun,704,NULL
1889,A district or community within a town or city.,町または都市内の地区またはコミュニティ。,noun,705,NULL
1890,The set of points whose distance from a given point is less than (or less than or equal to) some value.,特定のポイントからの距離がある値よりも小さい（または以下の）ポイントのセット。,noun,705,NULL
1891,Pursue in order to catch or catch up with.,追いつくか追いつくために追求しなさい。,transitive verb,706,NULL
1892,Drive or cause to go in a specified direction.,指定された方向に移動または移動させます。,transitive verb,706,NULL
1893,Try to make contact with (someone) in order to get something owed or required.,借りている、または必要なものを得るために、（誰か）と接触するようにしてください。,transitive verb,706,NULL
1894,Make further investigation of an unresolved matter.,未解決の問題をさらに調査します。,transitive verb,706,NULL
1895,An act of pursuing someone or something.,誰かまたは何かを追求する行為。,noun,706,NULL
1896,A structure or place made or chosen by a bird for laying eggs and sheltering its young.,鳥が産卵し、幼鳥を保護するために作成または選択した構造物または場所。,noun,707,NULL
1897,A place filled with or frequented by undesirable people or things.,望ましくない人や物で満たされている場所。,noun,707,NULL
1898,"A set of similar objects of graduated sizes, made so that each smaller one fits into the next in size for storage.",小さいサイズのオブジェクトがそれぞれ次のサイズに収まるように作成された、段階的なサイズの同様のオブジェクトのセット。,noun,707,NULL
1899,(of a bird or other animal) use or build a nest.,（鳥または他の動物の）巣を使用または構築する。,verb,707,NULL
